id,title,description,link,image_link,availability,price,brand,condition
dip-dye-coral-taper-candle-j9N4V8,Pack of 4 Dip Dye Coral Taper Candle,"These dip-dye taper candles feature a soft gradient design, adding a modern yet elegant touch to any table setting. Perfect for special occasions or everyday ambiance.*Material: Wax*Dimensions: 9.2x2.2x30.5cm*Set includes 4 taper candles",https://joyandco.com/product/dip-dye-coral-taper-candle-j9N4V8,https://joyandco.com/storage/app/public/product/meta/def.webp,in stock,45 AED,KERSTEN,new
dip-dye-orange-taper-candle-pack-of-4-yMIpt2,Pack of 4 Dip Dye Orange Taper Candle,"These dip-dye taper candles feature a soft gradient design, adding a modern yet elegant touch to any table setting. Perfect for special occasions or everyday ambiance.*Material: Wax*Dimensions: 9.2x2.2x30.5cm*Set includes 4 taper candles",https://joyandco.com/product/dip-dye-orange-taper-candle-pack-of-4-yMIpt2,https://joyandco.com/storage/app/public/product/meta/def.webp,in stock,45 AED,KERSTEN,new
disks-planter-GFwX5i,Disks Planter,"Add a playful touch to your space with this modern stoneware planter featuring a unique multicolor geometric design. Perfect for displaying plants or as a decorative accent, it brings a fun and contemporary vibe to any room.*Material: Stoneware*Dimensions: 19.2x19.2x14cm",https://joyandco.com/product/disks-planter-GFwX5i,https://joyandco.com/storage/app/public/product/meta/def.webp,in stock,250 AED,KERSTEN,new
disks-vase-lLL4HA,Disks Vase,Add a modern touch to your space with this stoneware vase featuring a playful multicolor geometric design. It brings a fun and contemporary vibe to any décor.*Material: Stoneware*Dimensions: 21x21x31.5cm,https://joyandco.com/product/disks-vase-lLL4HA,https://joyandco.com/storage/app/public/product/meta/def.webp,in stock,350 AED,KERSTEN,new
edion-oud-3000ml-Fa1UyW,EDION Oud 3000ML,"Intriguing fragrance with extreme charm with odors and olfactory notes that stimulate deep chords and recall distant atmospheres.All this given by saffron known as the red gold of spices, which blends with woody and at the same time delicate heart notes such as rose, supported by spicy base notes. A perfume with a strong personality, intriguing with extreme charm.Characteristics: fragrance with spicy oriental notesTop : cardamom, cistus, saffronHeart : cedar wood, jasmine, roseBase : amber, musk, sandalwood, leather, animalic notes.3000MLPresented in an EDION box. Comes in an exclusive resin bottle in teal color.Silk Black Sticks included.Made in Italy.",https://joyandco.com/product/edion-oud-3000ml-Fa1UyW,https://joyandco.com/storage/app/public/product/meta/def.webp,in stock,2790 AED,EDION,new
edion-oud-pqTyyh,EDION Oud 700ML,"Intriguing fragrance with extreme charm with odors and olfactory notes that stimulate deep chords and recall distant atmospheres.All this given by saffron known as the red gold of spices, which blends with woody and at the same time delicate heart notes such as rose, supported by spicy base notes. A perfume with a strong personality, intriguing with extreme charm.Characteristics: fragrance with spicy oriental notesTop : cardamom, cistus, saffronHeart : cedar wood, jasmine, roseBase : amber, musk, sandalwood, leather, animalic notes.700MLPresented in an EDION box. Comes in an exclusive bottle designed for JOY&CO, in smoked olive green with gold leaf.Silk Black Sticks included.Made in Italy.",https://joyandco.com/product/edion-oud-pqTyyh,https://joyandco.com/storage/app/public/product/meta/def.webp,in stock,775 AED,EDION,new
emma-candle-holder-5q00Ow,Emma Candle Holder,"The Emma Candle Holder with its bubble-style design and vibrant brown glass, adds a modern and stylish touch to any space.Material: GlassDimensions: 8.5x8.5x29 cm",https://joyandco.com/product/emma-candle-holder-5q00Ow,https://joyandco.com/storage/app/public/product/meta/def.webp,in stock,115 AED,WERNS,new
english-delft-dinner-plate-classics-on-acid-f5m2Cz,English Delft Dinner Plate - Classics on Acid,"A classic look with a bold twist for party lovers and eclectic enthusiasts. Seletti x Diesel Living collection revisits well-known classical porcelain themes from across the world through an ""after party"" lens. On this porcelain dinner plate, key themes of the Dutch Delftware pottery style are warped and contorted for an unexpected merger of the crazy and the classical.Material: Bone China porcelainSize: ⌀28cmNot suitable for dishwasherNot suitable for microwave",https://joyandco.com/product/english-delft-dinner-plate-classics-on-acid-f5m2Cz,https://joyandco.com/storage/app/public/product/meta/def.webp,in stock,295 AED,SELETTI,new
evergreen-vase-waLCAv,Evergreen Vase,"This green stoneware vase features a rustic, textured design, making it a perfect addition to a natural and serene decor. Its organic look adds an earthy touch to any space.*Material: Stoneware*Dimensions: 8.7x8.7x22.1cm",https://joyandco.com/product/evergreen-vase-waLCAv,https://joyandco.com/storage/app/public/product/meta/def.webp,in stock,115 AED,KERSTEN,new
fancy-candle-holder-OnKt5h,Fancy Candle Holder,"The Fancy Candle Holder features a square shape and layered structure with bold green, turquoise, and purple glass. Its geometric design adds a touch of modernity and elegance.Material: GlassDimensions: 10x10x23 cm",https://joyandco.com/product/fancy-candle-holder-OnKt5h,https://joyandco.com/storage/app/public/product/meta/def.webp,in stock,228 AED,WERNS,new
fancy-pink-candle-holder-wSTBIb,Fancy Pink Candle Holder,"The Fancy Candle Holder features a square shape and layered structure with bold pink, red, and yellow glass. Its geometric design adds a touch of modernity and elegance.Material: GlassDimensions: 10x10x15 cm",https://joyandco.com/product/fancy-pink-candle-holder-wSTBIb,https://joyandco.com/storage/app/public/product/meta/def.webp,in stock,190 AED,JOY&CO PICKS,new
fancy-purple-candle-holder-Xumq0D,Fancy Purple Candle Holder,"The Fancy Candle Holder features a square shape and layered structure with bold orange, red, and purple glass. Its geometric design adds a touch of modernity and elegance.Material: GlassDimensions: 10x10x28 cm",https://joyandco.com/product/fancy-purple-candle-holder-Xumq0D,https://joyandco.com/storage/app/public/product/meta/def.webp,in stock,349 AED,JOY&CO PICKS,new
fancy-purple-candle-holder-ntWr5K,Fancy Purple Candle Holder,"The Fancy Candle Holder is a multicolored design made from glass, featuring a vibrant mix of colors that add a bold and modern touch to any space. Its sleek design makes it perfect for enhancing dining tables, mantels, or special occasions.Material: GlassDimensions: 10x10x60 cm",https://joyandco.com/product/fancy-purple-candle-holder-ntWr5K,https://joyandco.com/storage/app/public/product/meta/def.webp,in stock,720 AED,WERNS,new
fancy-tea-cup-set-with-saucer-gW5enB,Fancy Tea Cup Set with Saucer,"This vibrant set of tea cups adds a lively touch to your table setting. Designed in four assorted bold hues with a glossy gold rim, it exudes charm and elegance.*Material: Porcelain, real gold*Not suitable for dishwasher use*Not suitable for microwave*Dimensions: 15.5 cm x 8 cm*Available as a set of 4",https://joyandco.com/product/fancy-tea-cup-set-with-saucer-gW5enB,https://joyandco.com/storage/app/public/product/meta/def.webp,in stock,550 AED,WERNS,new
fancy-yellow-candle-holder-06TVHr,Fancy Yellow Candle Holder,"The Fancy Candle Holder is a multicolored design made from glass, featuring a vibrant mix of colors that add a bold and modern touch to any space. Its sleek design makes it perfect for enhancing dining tables, mantels, or special occasions.Material: GlassDimensions: 10x10x60 cm",https://joyandco.com/product/fancy-yellow-candle-holder-06TVHr,https://joyandco.com/storage/app/public/product/meta/def.webp,in stock,720 AED,WERNS,new
finya-vase-medium-xUMUdo,Finya Vase Medium,"Finya Vase is crafted from glass in green with a wavy, artistic design, it serves as a striking centerpiece or a decorative accent.*Material: Glass*Dimensions: 25x25x21 cm",https://joyandco.com/product/finya-vase-medium-xUMUdo,https://joyandco.com/storage/app/public/product/meta/def.webp,in stock,310 AED,WERNS,new
finya-vase-small-u9P1wN,Finya Vase Small,"Finya Vase is crafted from glass in a soft blue hue with a fluid, artistic design, it serves as a striking centerpiece or a decorative accent.*Material: Glass*Dimensions: 20x 20x21 cm",https://joyandco.com/product/finya-vase-small-u9P1wN,https://joyandco.com/storage/app/public/product/meta/def.webp,in stock,225 AED,WERNS,new
fiorentino-dessert-plate-classics-on-acid-LwzVgz,Fiorentino Dessert Plate - Classics on Acid,"A classic look with a bold twist for party lovers and eclectic enthusiasts. Seletti x Diesel Living collection revisits well-known classical porcelain themes from across the world through an ""after party"" lens. On this porcelain dinner plate, key themes of the Dutch Delftware pottery style are warped and contorted for an unexpected merger of the crazy and the classical.Material: Bone China porcelainSize: ⌀21cmNot suitable for dishwasherNot suitable for microwave",https://joyandco.com/product/fiorentino-dessert-plate-classics-on-acid-LwzVgz,https://joyandco.com/storage/app/public/product/meta/def.webp,in stock,195 AED,SELETTI,new
firelight-duo-vase-b58wuT,Firelight Duo Vase,"Turn up the drama with the Firelight Duo Vase, a bold statement in two rich tones of red glass. Its smooth curves and layered color create a striking silhouette that brings warmth and depth to any setting. Whether styled with florals or standing alone, it’s the perfect accent for a dynamic, modern look.Material: GlassDimensions: 19 x 19 x 30 cm",https://joyandco.com/product/firelight-duo-vase-b58wuT,https://joyandco.com/storage/app/public/product/meta/def.webp,in stock,285 AED,KERSTEN,new
fish-fete-plate-set-wiq5aC,Fish Fête Plate Set,"Bring a playful coastal spirit to your table with the Fish Fête set. Each plate features a hand-painted sea creature: crab, lobster, squid, and shrimp, crafted on natural ceramic with artisanal charm.*Handmade and hand-painted for unique character*Dimensions: 22x2 cm*Suitable for dishwasher*Suitable for oven use*Not suitable for microwave*Set of 4 plates (one of each design)Each piece is entirely handmade, and slight variations or imperfections are part of its natural character. Your item may differ slightly from the one shown in the photo, making it truly one of a kind.Made in Portugal using traditional techniques.",https://joyandco.com/product/fish-fete-plate-set-wiq5aC,https://joyandco.com/storage/app/public/product/meta/def.webp,in stock,700 AED,VAL POTTERY,new
flower-bird-soup-plate-classics-on-acid-6Q6xUy,Flower Bird Soup Plate - Classics on Acid,"A classic look with a bold twist for party lovers and eclectic enthusiasts. Seletti x Diesel Living collection revisits well-known classical porcelain themes from across the world through an ""after party"" lens. On this porcelain dinner plate, key themes of the Dutch Delftware pottery style are warped and contorted for an unexpected merger of the crazy and the classical.Material: Bone China porcelainSize: ⌀25.4x4.6 cmNot suitable for dishwasherNot suitable for microwave",https://joyandco.com/product/flower-bird-soup-plate-classics-on-acid-6Q6xUy,https://joyandco.com/storage/app/public/product/meta/def.webp,in stock,345 AED,SELETTI,new
flower-girl-candleholde-pink-Hv3IdF,Flower Girl Candleholder Pink,"Dressed in rosy pink and crowned with a warm orange flower, this playful candle holder adds charm and color to any setting. A whimsical piece to mix and match across seasons.Material: StonewareDimensions: 7x7x18 cmFits standard taper candles",https://joyandco.com/product/flower-girl-candleholde-pink-Hv3IdF,https://joyandco.com/storage/app/public/product/meta/def.webp,in stock,83 AED,KERSTEN,new
flower-girl-candleholder-lilac-l77Ql5,Flower Girl Candleholder Lilac,"This soft lilac flower girl, topped with a cheerful yellow bloom, lends a gentle, fairy-tale vibe to your display. A subtle statement piece for playful styling.Material: StonewareDimensions: 7x7x18 cmFits standard taper candles",https://joyandco.com/product/flower-girl-candleholder-lilac-l77Ql5,https://joyandco.com/storage/app/public/product/meta/def.webp,in stock,83 AED,KERSTEN,new
flower-girl-candleholder-ochre-dtKhkX,Flower Girl Candleholder Ochre,"With her warm ochre dress and crisp white flower crown, this candle holder brings an earthy yet refined character to any corner. Ideal on its own or paired with the full set.Material: StonewareDimensions: 7x7x18 cmFits standard taper candles",https://joyandco.com/product/flower-girl-candleholder-ochre-dtKhkX,https://joyandco.com/storage/app/public/product/meta/def.webp,in stock,83 AED,KERSTEN,new
flower-girl-candleholder-yellow-CA8gpn,Flower Girl Candleholder Yellow,"A sweet flower girl in a sunny yellow dress topped with a delicate pink bloom. She brings a soft, joyful touch to any table or shelf, perfect for brightening everyday moments or special gatherings.Material: StonewareDimensions: 7x7x18 cmFits standard taper candles",https://joyandco.com/product/flower-girl-candleholder-yellow-CA8gpn,https://joyandco.com/storage/app/public/product/meta/def.webp,in stock,83 AED,KERSTEN,new
flower-girl-set-of-4-ADbOHH,Flower Girl Set Of 4,"A charming quartet of candlestick holders, each shaped like a flower girl dressed in pastel tones and crowned with a bloom. The Flower Girl Set of 4 adds a playful, storybook touch to your table, shelf, or celebration, perfect for adding both color and character to your décor.Material: StonewareDimensions: 7x7x18 cm eachFits standard taper candles",https://joyandco.com/product/flower-girl-set-of-4-ADbOHH,https://joyandco.com/storage/app/public/product/meta/def.webp,in stock,299 AED,KERSTEN,new
flute-water-glass-classics-on-acid-ENZuHe,Flute Water Glass - Classics on Acid,"A classic look with a bold twist for party lovers and eclectic enthusiasts. Seletti x Diesel Living collection revisits well-known classical porcelain themes from across the world through an ""after party"" lens. On this porcelain dinner plate, key themes of the Dutch Delftware pottery style are warped and contorted for an unexpected merger of the crazy and the classical.Material: GlassSize: ⌀7x9.5 cmNot suitable for dishwasherNot suitable for microwave",https://joyandco.com/product/flute-water-glass-classics-on-acid-ENZuHe,https://joyandco.com/storage/app/public/product/meta/def.webp,in stock,95 AED,SELETTI,new
forever-always-plate-4gLiFv,Forever Always Plate,"Chiara Perano is an Italian-English artist and illustrator, based in the South of England.Her style draws inspiration from her Italian roots, from La Dolce Vita. She expresses herself with antique touches that celebrate the simple joys of everyday life: family, good food and living the seasons to the fullest. Her collection for Bitossi brings love to your table setup.This plate is crafted from premium porcelain, featuring Chiara Perano’s hand-drawn design with the words “Forever Always” alongside two bluebirds and delicate star accents. Finished with a fine gold rim, it brings elegance and charm to any table setting. Ideal for serving desserts, fruits, or as a decorative piece to elevate any dining experience.*Material: Porcelain*Suitable for dishwasher use (up to 250 washes)*Not suitable for microwave*Dimensions: 17cmMade in Italy",https://joyandco.com/product/forever-always-plate-4gLiFv,https://joyandco.com/storage/app/public/product/meta/2025-02-20-67b70b9e829b0.webp,in stock,163 AED,BITOSSI,new
fresh-orange-can-vase-4R6YOh,Fresh Orange Can Vase,"Freshen up any corner with the Fresh Orange vase. Its bold green stripes and cheerful citrus label make it a standout piece for colorful interiors. Crafted from earthenware, it mixes whimsy with style.Material: EarthenwareDimensions: 7x7x11.3 cm",https://joyandco.com/product/fresh-orange-can-vase-4R6YOh,https://joyandco.com/storage/app/public/product/meta/def.webp,in stock,70 AED,KERSTEN,new
fruit-feast-plate-PGRiVb,Fruit Feast Plate,"Bring bold artistry to your table with the Fruit Feast plate. Hand-painted with lively green splatters, this large serving piece makes a playful yet elegant statement, perfect for fresh fruits, colorful salads, or showstopping centerpieces.*Handmade and hand-painted for unique character*Dimensions: 35.6x5 cm*Suitable for dishwasher*Suitable for oven use*Not suitable for microwaveEach piece is entirely handmade, and slight variations or imperfections are part of its natural character. Your item may differ slightly from the one shown in the photo, making it truly one of a kind.Made in Portugal using traditional techniques.",https://joyandco.com/product/fruit-feast-plate-PGRiVb,https://joyandco.com/storage/app/public/product/meta/def.webp,in stock,480 AED,VAL POTTERY,new
glitchy-willow-dessert-plate-classics-on-acid-BaIQCz,Glitchy Willow Dessert Plate - Classics on Acid,"A classic look with a bold twist for party lovers and eclectic enthusiasts. Seletti x Diesel Living collection revisits well-known classical porcelain themes from across the world through an ""after party"" lens. On this porcelain dinner plate, key themes of the Dutch Delftware pottery style are warped and contorted for an unexpected merger of the crazy and the classical.Material: Bone China porcelainSize: ⌀21cmNot suitable for dishwasherNot suitable for microwave",https://joyandco.com/product/glitchy-willow-dessert-plate-classics-on-acid-BaIQCz,https://joyandco.com/storage/app/public/product/meta/def.webp,in stock,195 AED,SELETTI,new
glow-jar-CIqmuy,Glow Jar,"Add a touch of elegance to your space with this glass jar in a beautiful gradient in lime and pink. Featuring a delicate diamond-cut pattern and a vintage-inspired lid, it’s perfect for storing sweets, trinkets, or small treasures in style.*Material: Glass*Dimensions: 17xø10 cmDesigned in Denmark.",https://joyandco.com/product/glow-jar-CIqmuy,https://joyandco.com/storage/app/public/product/meta/def.webp,in stock,155 AED,JOY&CO PICKS,new
good-morning-bowl-fWw1mw,Good Morning Bowl,The Good Morning Bowl to start the day of nice with your favourite breakfast.Specifications:• Measurements: 140 x 140 x 70 mm• Material: Ceramic• Dishwasher safe,https://joyandco.com/product/good-morning-bowl-fWw1mw,https://joyandco.com/storage/app/public/product/meta/def.webp,in stock,135 AED,ANNA + NINA,new
good-morning-breakfast-plate-apSbJE,Good Morning Breakfast Plate,The Good Morning Breakfast Plate to start the day of nice with your favourite breakfast.Specifications:• Measurements: 220 x 220 x 32 mm• Material: Ceramic• Dishwasher safe,https://joyandco.com/product/good-morning-breakfast-plate-apSbJE,https://joyandco.com/storage/app/public/product/meta/def.webp,in stock,145 AED,ANNA + NINA,new
good-morning-mug-Qe5Bej,Good Morning Mug,The Good Morning Mug is made using ceramic. If this mug is not giving you a really good morning with your beloved coffee in it - we don't know what is.Specifications:• Material: ceramic• Measurement height: 9 cm• Diameter: 9 cm• Dishwasher safe• Handmade,https://joyandco.com/product/good-morning-mug-Qe5Bej,https://joyandco.com/storage/app/public/product/meta/def.webp,in stock,110 AED,ANNA + NINA,new
gorilla-gentleman-Hnh5S9,Gorilla Gentleman,"This modern and exclusive canvas painting is an eye-catcher for every space. The piece combines a high-quality giclée print with hand-painted accents by an artist, creating a unique statement.Each hand-painted picture will show minor variations in colour or shape which represent the uniqueness of the painting.Dimensions: 82.5x122.5x4.5 cmMaterial: Canvas on wooden frame and Acrylic paintFrame includedTechnique: Giclée skilfully finished by handFormat: Upright formatDue to different screen/display settings, there are slight colour deviations in the display of the image material.",https://joyandco.com/product/gorilla-gentleman-Hnh5S9,https://joyandco.com/storage/app/public/product/meta/def.webp,in stock,1550 AED,JOY&CO PICKS,new
hollandia-flowers-dinner-plate-classics-on-acid-IKSvjk,Hollandia Flowers Dinner Plate - Classics on Acid,"A classic look with a bold twist for party lovers and eclectic enthusiasts. Seletti x Diesel Living collection revisits well-known classical porcelain themes from across the world through an ""after party"" lens. On this porcelain dinner plate, key themes of the Dutch Delftware pottery style are warped and contorted for an unexpected merger of the crazy and the classical.Material: Bone China porcelainSize: ⌀28cmNot suitable for dishwasherNot suitable for microwave",https://joyandco.com/product/hollandia-flowers-dinner-plate-classics-on-acid-IKSvjk,https://joyandco.com/storage/app/public/product/meta/def.webp,in stock,295 AED,SELETTI,new
hybrid-tea-cup-isidora-HPVap0,Hybrid Tea Cup Isidora,"When east and west combine. A collection that reflects ancient historic Western and Eastern ceramic production. Hybrid decorations that come from a complex past that evolve into contemporary shapes.Material: Bone China porcelainSize: ø10,5 x10,8x5,7cmSaucer ø15x2,5cmSuitable for dishwasherNot suitable for microwave",https://joyandco.com/product/hybrid-tea-cup-isidora-HPVap0,https://joyandco.com/storage/app/public/product/meta/def.webp,in stock,165 AED,SELETTI,new
hybrid-tea-cup-zora-with-saucer-xxizYV,Hybrid Tea Cup Zora with Saucer,"When east and west combine. A collection that reflects ancient historic Western and Eastern ceramic production. Hybrid decorations that come from a complex past that evolve into contemporary shapes.Material: Bone China porcelainSize: ø10,5 x10,8x5,7cmSaucer ø15x2,5cmSuitable for dishwasherNot suitable for microwave",https://joyandco.com/product/hybrid-tea-cup-zora-with-saucer-xxizYV,https://joyandco.com/storage/app/public/product/meta/def.webp,in stock,165 AED,SELETTI,new
hybrid-teapot-smeraldina-jP5GhE,Hybrid Teapot Smeraldina,When east and west combine. A collection that reflects ancient historic Western and Eastern ceramic production. Hybrid decorations that come from a complex past that evolve into contemporary shapes.Material: Bone China porcelainSize: ø15x13cmSuitable for dishwasherNot suitable for microwave,https://joyandco.com/product/hybrid-teapot-smeraldina-jP5GhE,https://joyandco.com/storage/app/public/product/meta/def.webp,in stock,510 AED,SELETTI,new
i-love-you-mug-JY2Lvh,I Love you Mug,The I Love You Mug is made using ceramic. This mug is perfect for telling your loved ones how you feel. Bring them their coffee in the morning and tell them how much you love them.Specifications:• Material: ceramic• Measurement height: 9 cm• Diameter: 9 cm• Dishwasher safe• Handmade,https://joyandco.com/product/i-love-you-mug-JY2Lvh,https://joyandco.com/storage/app/public/product/meta/def.webp,in stock,110 AED,ANNA + NINA,new
i-love-you-plate-sUITA2,Ti Amo Plate,"Chiara Perano is an Italian-English artist and illustrator, based in the South of England.Her style draws inspiration from her Italian roots, from La Dolce Vita. She expresses herself with antique touches that celebrate the simple joys of everyday life: family, good food and living the seasons to the fullest. Her collection for Bitossi brings love to your table setup.This plate is crafted from premium porcelain, featuring Chiara Perano’s phrase “Ti Amo” repeated across the surface, celebrating love and connection. Accentuated with a delicate gold rim and bold red waves, it brings a romantic and artistic flair to your table setting. Ideal for serving desserts, fruits, or as a decorative piece to elevate any dining experience.*Material: Porcelain*Suitable for dishwasher use (up to 250 washes)*Not suitable for microwave*Dimensions: 17cmMade in Italy",https://joyandco.com/product/i-love-you-plate-sUITA2,https://joyandco.com/storage/app/public/product/meta/def.webp,in stock,163 AED,BITOSSI,new
jacks-cig-ashtray-large-1w8qhm,Jack’s Cig Ashtray Large,"Make a statement with Jack’s Cig Ashtray, a bold, hand-painted ashtray crafted for outdoor gatherings. With its oversized design and playful splash pattern, it keeps your terrace clean and stylish, even on breezy days.*Handmade and hand-painted for unique character*Dimensions: 28.5x12.5 cm*Perfect for outdoor use*Suitable for dishwasherEach piece is entirely handmade, and slight variations or imperfections are part of its natural character. Your item may differ slightly from the one shown in the photo, making it truly one of a kind.Made in Portugal using traditional techniques.",https://joyandco.com/product/jacks-cig-ashtray-large-1w8qhm,https://joyandco.com/storage/app/public/product/meta/def.webp,in stock,690 AED,VAL POTTERY,new
jacks-cig-ashtray-nPYWV9,Jack’s Cig Ashtray,"Add a splash of personality to your outdoor setup with Jack’s Cig: a bold, hand-painted ashtray that brings style and function to your garden table. Designed to stay put even in breezy weather, it's as practical as it is eye-catching.*Handmade and hand-painted for unique character*Dimensions: 13x8 cm*Perfect for outdoor use*Suitable for dishwasherEach piece is entirely handmade, and slight variations or imperfections are part of its natural character. Your item may differ slightly from the one shown in the photo, making it truly one of a kind.Made in Portugal using traditional techniques.",https://joyandco.com/product/jacks-cig-ashtray-nPYWV9,https://joyandco.com/storage/app/public/product/meta/def.webp,in stock,252 AED,VAL POTTERY,new
